{
  "schema_version": 1,
  "example_id": "syn-004",
  "task_id": "feat/synthetic-diff-review",
  "created_at": "2026-07-12T11:00:00Z",
  "split": "train",
  "features": {
    "prompt_fingerprint": "sha256:synthetic-004",
    "features_version": "task-features-v1",
    "feature_snapshot": "Review the diff against the verification commands in the task contract.",
    "task_contract": {
      "available_fields": [
        "scope",
        "off_limits",
        "verification"
      ],
      "verification_declared": true
    },
    "repository_bucket": "python-cli",
    "quota": {
      "source": "fixture",
      "source_confidence": "reported",
      "providers": [
        {
          "name": "codex",
          "remaining": 0.48,
          "window": "5h"
        }
      ]
    }
  },
  "labels": {
    "work_kind": "verification",
    "size": "s",
    "risk": "low",
    "intended_sequence": [
      "verifier"
    ],
    "should_abstain": false,
    "labeler": "synthetic",
    "labeled_at": "2026-07-12T11:05:00Z"
  },
  "human_decision": {
    "status": "accept"
  },
  "outcome": {
    "schema_version": 1,
    "decision_id": "dec-004",
    "actual_route": {
      "role": "verifier",
      "endpoint": "codex",
      "model_tier": "balanced-coding",
      "reasoning_tier": "medium"
    },
    "usage": {
      "reported_tokens": 4000,
      "api_equivalent_cost": null,
      "subscription_quota_delta": 0.01,
      "source": "fixture",
      "source_confidence": "reported"
    },
    "result": {
      "check": "pass",
      "verify": "pass",
      "repair_rounds": 0,
      "replan": false,
      "human_completed": true
    }
  }
}
