{
  "schema_version": 1,
  "example_id": "syn-007",
  "task_id": "feat/synthetic-holdout-bug",
  "created_at": "2026-08-02T09:00:00Z",
  "split": "holdout",
  "features": {
    "prompt_fingerprint": "sha256:synthetic-007",
    "features_version": "task-features-v1",
    "feature_snapshot": "Fix the stale cache invalidation bug in the worktree status path.",
    "task_contract": {
      "available_fields": [
        "scope",
        "off_limits",
        "verification"
      ],
      "verification_declared": true
    },
    "repository_bucket": "python-cli",
    "quota": {
      "source": "fixture",
      "source_confidence": "reported",
      "providers": [
        {
          "name": "codex",
          "remaining": 0.58,
          "window": "5h"
        }
      ]
    }
  },
  "labels": {
    "work_kind": "execution",
    "size": "s",
    "risk": "medium",
    "intended_sequence": [
      "executor",
      "verifier"
    ],
    "should_abstain": false,
    "labeler": "synthetic",
    "labeled_at": "2026-08-02T09:04:00Z"
  },
  "human_decision": {
    "status": "accept"
  },
  "outcome": {
    "schema_version": 1,
    "decision_id": "dec-007",
    "actual_route": {
      "role": "executor",
      "endpoint": "codex",
      "model_tier": "balanced-coding",
      "reasoning_tier": "medium"
    },
    "usage": {
      "reported_tokens": 11000,
      "api_equivalent_cost": null,
      "subscription_quota_delta": 0.04,
      "source": "fixture",
      "source_confidence": "reported"
    },
    "result": {
      "check": "pass",
      "verify": "pass",
      "repair_rounds": 0,
      "replan": false,
      "human_completed": true
    }
  },
  "predictions": {
    "shadow-rules": {
      "classification": {
        "work_kind": "execution",
        "size": "s",
        "risk": "medium",
        "confidence": 0.8,
        "recommended_sequence": [
          "executor",
          "verifier"
        ],
        "abstain": false,
        "classifier_version": "shadow-rules-v0"
      },
      "recommended_route": {
        "role": "executor",
        "endpoint": "codex",
        "model_tier": "balanced-coding",
        "reasoning_tier": "medium"
      },
      "forecast": {
        "reported_tokens_p50": 10000,
        "reported_tokens_p90": 16000,
        "subscription_quota_delta_p50": 0.03,
        "subscription_quota_delta_p90": 0.06,
        "source_confidence": "inferred",
        "forecast_version": "shadow-v0"
      },
      "reason_codes": [
        "bounded_change",
        "verification_declared"
      ],
      "abstain": false,
      "system_id": "shadow-rules"
    }
  }
}
