{
  "schema_version": 1,
  "example_id": "syn-009",
  "task_id": "feat/synthetic-holdout-handoff",
  "created_at": "2026-08-10T08:00:00Z",
  "split": "holdout",
  "features": {
    "prompt_fingerprint": "sha256:synthetic-009",
    "features_version": "task-features-v1",
    "feature_snapshot": "Write the handoff commit message and cleanup leftover worktree metadata.",
    "task_contract": {
      "available_fields": [
        "scope",
        "off_limits",
        "verification"
      ],
      "verification_declared": true
    },
    "repository_bucket": "python-cli",
    "quota": {
      "source": "fixture",
      "source_confidence": "reported",
      "providers": [
        {
          "name": "codex",
          "remaining": 0.44,
          "window": "5h"
        }
      ]
    }
  },
  "labels": {
    "work_kind": "finishing",
    "size": "xs",
    "risk": "low",
    "intended_sequence": [
      "finisher"
    ],
    "should_abstain": false,
    "labeler": "synthetic",
    "labeled_at": "2026-08-10T08:03:00Z"
  },
  "human_decision": {
    "status": "accept"
  },
  "outcome": {
    "schema_version": 1,
    "decision_id": "dec-009",
    "actual_route": {
      "role": "finisher",
      "endpoint": "codex",
      "model_tier": "balanced-coding",
      "reasoning_tier": "medium"
    },
    "usage": {
      "reported_tokens": 1500,
      "api_equivalent_cost": null,
      "subscription_quota_delta": 0.005,
      "source": "fixture",
      "source_confidence": "reported"
    },
    "result": {
      "check": "pass",
      "verify": "pass",
      "repair_rounds": 0,
      "replan": false,
      "human_completed": true
    }
  }
}
