{
  "schema_version": 1,
  "example_id": "syn-008",
  "task_id": "feat/synthetic-holdout-architecture",
  "created_at": "2026-08-06T14:00:00Z",
  "split": "holdout",
  "features": {
    "prompt_fingerprint": "sha256:synthetic-008",
    "features_version": "task-features-v1",
    "feature_snapshot": "Design the architecture for a second observation adapter without copying TokenTracker.",
    "task_contract": {
      "available_fields": [
        "scope",
        "off_limits",
        "verification"
      ],
      "verification_declared": true
    },
    "repository_bucket": "python-cli",
    "quota": {
      "source": "fixture",
      "source_confidence": "reported",
      "providers": [
        {
          "name": "codex",
          "remaining": 0.51,
          "window": "5h"
        }
      ]
    }
  },
  "labels": {
    "work_kind": "planning",
    "size": "l",
    "risk": "high",
    "intended_sequence": [
      "planner"
    ],
    "should_abstain": false,
    "labeler": "synthetic",
    "labeled_at": "2026-08-06T14:12:00Z"
  },
  "human_decision": {
    "status": "accept"
  },
  "outcome": {
    "schema_version": 1,
    "decision_id": "dec-008",
    "actual_route": {
      "role": "planner",
      "endpoint": "codex",
      "model_tier": "balanced-coding",
      "reasoning_tier": "medium"
    },
    "usage": {
      "reported_tokens": 24000,
      "api_equivalent_cost": null,
      "subscription_quota_delta": 0.09,
      "source": "fixture",
      "source_confidence": "reported"
    },
    "result": {
      "check": "skip",
      "verify": "skip",
      "repair_rounds": 0,
      "replan": false,
      "human_completed": true
    }
  }
}
