{
  "schema_version": 1,
  "example_id": "syn-003",
  "task_id": "feat/synthetic-quota-adapters",
  "created_at": "2026-07-08T15:00:00Z",
  "split": "train",
  "features": {
    "prompt_fingerprint": "sha256:synthetic-003",
    "features_version": "task-features-v1",
    "feature_snapshot": "Design the architecture for quota snapshot adapters across providers.",
    "task_contract": {
      "available_fields": [
        "scope",
        "off_limits",
        "verification"
      ],
      "verification_declared": true
    },
    "repository_bucket": "python-cli",
    "quota": {
      "source": "fixture",
      "source_confidence": "reported",
      "providers": [
        {
          "name": "codex",
          "remaining": 0.71,
          "window": "5h"
        }
      ]
    }
  },
  "labels": {
    "work_kind": "planning",
    "size": "m",
    "risk": "high",
    "intended_sequence": [
      "planner"
    ],
    "should_abstain": false,
    "labeler": "synthetic",
    "labeled_at": "2026-07-08T15:10:00Z"
  },
  "human_decision": {
    "status": "accept"
  },
  "outcome": {
    "schema_version": 1,
    "decision_id": "dec-003",
    "actual_route": {
      "role": "planner",
      "endpoint": "codex",
      "model_tier": "balanced-coding",
      "reasoning_tier": "medium"
    },
    "usage": {
      "reported_tokens": 20000,
      "api_equivalent_cost": null,
      "subscription_quota_delta": 0.08,
      "source": "fixture",
      "source_confidence": "reported"
    },
    "result": {
      "check": "skip",
      "verify": "skip",
      "repair_rounds": 0,
      "replan": false,
      "human_completed": true
    }
  }
}
